{
  "schema_version": 2,
  "evidence_id": "EV-018fa2b3-12cd-7abc-8abc-0123456789ab",
  "object_id": "obj-sha256-5d000b44db178b31c4aca20a5ef5741adb7e14b8297a2139e83f4119c783dd5f",
  "title": "Synthetic fixture",
  "classification": "private",
  "created_at": "2026-10-09T20:43:00+09:00",
  "matter_ids": [
    "example-only"
  ]
}
